{
  "schemaVersion": 1,
  "updatedAt": "2026-07-22T12:00:00-07:00",
  "timezone": "America/Los_Angeles",
  "quotes": [
    {
      "text": "I eat the beat like food, so delicious, nutritious, I don't even believe in dishes."
    },
    {
      "text": "I got the bars showing up in my yard, holographic cards like I'm a Charizard."
    },
    {
      "text": "I'm a storm in a teacup, no one can keep up."
    },
    {
      "text": "No stop signs, I only get green lights, I'm on the highway to Shell."
    },
    {
      "text": "I ain't got no gifts, but my present is a presence."
    },
    {
      "text": "I do not swear, I do not cuss, but I am who they discuss."
    },
    {
      "text": "The microphone assassin, dropping hits like what's happening."
    },
    {
      "text": "You should never interrupt when I put clever words together."
    },
    {
      "text": "I grab the microphone underground, I know I'm buried, so I switch it up with my vocabulary."
    },
    {
      "text": "The girl who flies and talks so nice, it's only right that I was born to use mics."
    },
    {
      "text": "A Canalian is a Canadian alien."
    },
    {
      "text": "They told me I rap like Eminem; I told them I'm not a Skittle, I'm basically Dr. Dolittle."
    },
    {
      "text": "My name is Shells, but I won't clam up, I'm no oyster."
    },
    {
      "text": "Good thing my freestyles are like potatoes, they're versatile."
    },
    {
      "text": "If you can't handle me at my hula blooping, you don't deserve me at my hula hooping."
    },
    {
      "text": "Don't forget to hydrate, because if you don't hydrate, you will dehydrate."
    },
    {
      "text": "I don't even really make mistakes, so there's no need for erasers."
    },
    {
      "text": "I'm my own boss, you're looking real unemployed."
    },
    {
      "text": "The amount of times I said 'eh' and 'sorry' today, I might as well have rolled in with a bottle of maple syrup."
    },
    {
      "text": "I am gazpacho, you a sorbet, 'cause I'm serving gelato."
    },
    {
      "text": "The more you do it, the less you suck, and the less you suck, the more you like it."
    },
    {
      "text": "I've decided no one in this universe is allowed to have a bad time ever, we're just gonna aggressively love them until they're happy."
    },
    {
      "text": "My main mission on this earth is to make sure you have a good day."
    },
    {
      "text": "The only competition you got is you."
    },
    {
      "text": "If no one got you flowers, I got a bunch for you right here, please, smell the roses."
    },
    {
      "text": "The days you needed the most end up becoming the most memorable."
    },
    {
      "text": "Sometimes we gotta disconnect to feel connected."
    },
    {
      "text": "This is my swamp, I'ma do what I want."
    },
    {
      "text": "We do it the female way, without any kind of failure, we refuse to lose."
    },
    {
      "text": "I'm taking over the internet like I'm a virus, but I'm a good virus, so I don't need no firewall."
    },
    {
      "text": "They think they're fast, but I'm quicker, I'm Russian, but I'm never in a hurry."
    },
    {
      "text": "You know my channel, you click it, I got flow finer than a parking ticket."
    },
    {
      "text": "I'll be the rapper that plays instrumentals for her friends to decimate."
    },
    {
      "text": "Loneliness is louder when the whole world tries to help me."
    },
    {
      "text": "You helped me grow so much that I outgrew everything I knew."
    },
    {
      "text": "Your word gave me energy, so now you're watching me like I was your TV."
    },
    {
      "text": "I'm not a PokÃ©mon, but I'ma evolve every day."
    },
    {
      "text": "Juicy as a watermelon when I use my melon."
    },
    {
      "text": "To be incredible, you gotta practice a lot, and you gotta eat your vegetables."
    },
    {
      "text": "A little bit of Thug Shells is good for your health."
    },
    {
      "text": "And I told you: the best ship is friendship."
    },
    {
      "text": "Friendly neighborhood thug giving y'all love, my version of a favorite drug is a group hug."
    },
    {
      "text": "Slanted rhymes are like primary colors for a painter, they open up a whole new world."
    },
    {
      "text": "Whatever you choose, choose it with your whole heart, if you keep your foot in half a decision, nothing's gonna make sense."
    },
    {
      "text": "Whatever you want to do well, you can do, you've just got to have that attitude."
    },
    {
      "text": "It's important to be the real version of you. Always be genuine."
    },
    {
      "text": "It's temporary. Once you remember that, decisions become less scary, and so does the weight that you carry."
    },
    {
      "text": "Gratitude's the attitude when I'm in the baddest mood."
    },
    {
      "text": "Emotions are beautiful: there's love where there is sadness, and sadness where there's love."
    },
    {
      "text": "We do it for the tribe, we don't divide, we multiply."
    },
    {
      "text": "Live your life, play your part. When it's hard, make it your art. Use your heart, never be afraid to start, leave your mark."
    },
    {
      "text": "If you get frustrated, that means you've got to push through it, because we don't give up. We're tough. We're gangsters."
    },
    {
      "text": "I don't compete, but I get the trophy."
    },
    {
      "text": "Even from the fire, champions are born."
    },
    {
      "text": "Persistently patient, we aim for amazement."
    },
    {
      "text": "Any room that I'm inside turns to a rave."
    }
  ],
  "streams": {
    "channelUrl": "https://twitch.tv/thugshells",
    "djChannelUrl": "https://twitch.tv/thugshellsdj",
    "schedule": [
      {
        "weekday": "tuesday",
        "startTime": "19:00",
        "title": "Freestyle Fridays… on Tuesday"
      },
      {
        "weekday": "thursday",
        "startTime": "20:30",
        "title": "Beat Lab & Cypher"
      },
      {
        "weekday": "friday",
        "startTime": "13:00",
        "title": "Friday Stream"
      },
      {
        "weekday": "saturday",
        "startTime": "14:00",
        "title": "DJ Drum and Bass Stream"
      },
      {
        "weekday": "saturday",
        "startTime": "15:00",
        "title": "Fan Battle Saturdays"
      }
    ]
  },
  "events": [
    {
      "title": "Dirtwire: Temple of Harm Reduction Fundraiser",
      "venue": "888 Garage SF",
      "city": "San Francisco, CA",
      "startsAt": "2026-07-24T20:00:00-07:00",
      "timezone": "America/Los_Angeles",
      "ticketUrl": "https://www.tixr.com/groups/midwaysf/events/dirtwire-at-888-garage-195240"
    },
    {
      "title": "Summer Cypher Tour",
      "venue": "The Fillmore",
      "city": "San Francisco, CA",
      "startsAt": "2026-07-18T20:00:00-07:00",
      "timezone": "America/Los_Angeles",
      "ticketUrl": "https://tickets.example.com/sf"
    },
    {
      "title": "Rooftop Freestyle Session",
      "venue": "Output",
      "city": "Brooklyn, NY",
      "startsAt": "2026-08-02T21:00:00-04:00",
      "timezone": "America/New_York",
      "ticketUrl": "https://tickets.example.com/bk",
      "streamUrl": "https://twitch.tv/thugshells"
    },
    {
      "title": "11th Annual Parks & Rex Dog Pool Party",
      "venue": "Simpkins Family Swim Center",
      "city": "Santa Cruz, CA",
      "startsAt": "2026-08-15T11:00:00-07:00",
      "timezone": "America/Los_Angeles",
      "ticketUrl": "https://parks.santacruzcountyca.gov/Home/FindAProgram/Recreation/ParksRex.aspx"
    },
    {
      "title": "GOAT Homecoming",
      "venue": "The Novo",
      "city": "Los Angeles, CA",
      "startsAt": "2026-09-12T19:30:00-07:00",
      "timezone": "America/Los_Angeles",
      "ticketUrl": "https://tickets.example.com/la"
    }
  ],
  "socials": [
    {
      "label": "Website",
      "url": "https://www.thugshells.ca/",
      "platform": "website"
    },
    {
      "label": "Twitch",
      "url": "https://twitch.tv/thugshells",
      "platform": "twitch"
    },
    {
      "label": "Twitch (DJ)",
      "url": "https://twitch.tv/thugshellsdj",
      "platform": "twitch"
    },
    {
      "label": "Instagram",
      "url": "https://www.instagram.com/thugshells/",
      "platform": "instagram"
    },
    {
      "label": "YouTube",
      "url": "https://www.youtube.com/c/ThugShells",
      "platform": "youtube"
    }
  ],
  "newsletter": {
    "title": "Weekly Newsletter",
    "description": "Updates on what thuggy's been up to, from behind the streams content to upcoming events, to cute pet pics!",
    "signupUrl": "https://www.thugshells.ca/"
  }
}
